<?xml version="1.0" encoding="UTF-8"?>
<xs:schema xmlns:xs="http://www.w3.org/2001/XMLSchema">

    <xs:element name="courses">
        <xs:complexType>
            <xs:sequence>
                <xs:element name="course" maxOccurs="unbounded">
                    <xs:complexType>
                        <xs:sequence>
                            <xs:element name="title" type="xs:string"/>
                            <xs:element name="instructor" type="xs:string"/>
                            <xs:element name="price">
                                <xs:complexType>
                                    <xs:simpleContent>
                                        <xs:extension base="xs:decimal">
                                            <xs:attribute name="currency" type="xs:string" use="required"/>
                                        </xs:extension>
                                    </xs:simpleContent>
                                </xs:complexType>
                            </xs:element>
                            <xs:element name="rating" type="xs:decimal"/>
                            <xs:element name="duration" type="xs:string"/>
                            <xs:element name="category" type="xs:string"/>
                            <xs:element name="bestseller" type="xs:boolean"/>
                            <xs:element name="description" type="xs:string"/>
                        </xs:sequence>
                        <xs:attribute name="id" type="xs:ID" use="required"/>
                    </xs:complexType>
                </xs:element>
            </xs:sequence>
        </xs:complexType>
    </xs:element>

</xs:schema>
