<?xml version="1.0" encoding="UTF-8"?>
<courses xmlns:xsi="http://www.w3.org/2001/XMLSchema-instance" xsi:noNamespaceSchemaLocation="courses.xsd">
    <course id="c1">
        <title>Complete Web Masterclass</title>
        <instructor>Alakh Pandey</instructor>
        <price currency="INR">3999</price>
        <rating>4.9</rating>
        <duration>3 months</duration>
        <category>Web Development</category>
        <bestseller>true</bestseller>
        <description>This comprehensive course covers everything you need to know to become a full-stack web developer.</description>
    </course>
    <course id="c2">
        <title>Data Science Bootcamp</title>
        <instructor>Love Babbar</instructor>
        <price currency="INR">4999</price>
        <rating>4.7</rating>
        <duration>4 months</duration>
        <category>Data Science</category>
        <bestseller>false</bestseller>
        <description>Learn data analysis, visualization, and machine learning with Python.</description>
    </course>
    <course id="c3">
        <title>Modern UI/UX Design</title>
        <instructor>Striver</instructor>
        <price currency="INR">2999</price>
        <rating>4.8</rating>
        <duration>1 month</duration>
        <category>Design</category>
        <bestseller>false</bestseller>
        <description>A complete guide to designing beautiful and functional user interfaces using Figma.</description>
    </course>
</courses>
